LINE_ID,NAME,FROM_NODE,TO_NODE,R_PU,X_PU,B_PU,NUM_LINES
l_805,Gin Gin to Korenan Tee,717,720,5.385022706399695e-05,0.1123422988897098,9.681029244533474e-05,1
l_806,Gin Gin to Wurdong,717,432,3.116692059864579e-05,0.0716846920784685,0.0009573840251192526,1
l_807,Molendinar to Southport,314,581,8.568357945385458e-06,0.017440774630705987,7.613672793530256e-06,1
l_808,Bundaberg to Clayton,1,2,8.541032166720232e-06,0.01781829419883399,1.5354806598355394e-05,1
l_809,Isis to Aramara,672,673,2.8070389821638413e-05,0.05856042388726573,5.04640889342549e-05,1
l_810,Isis to Aramara,672,673,2.8477926079202637e-05,0.05941062568866693,5.119674516298319e-05,1
l_811,Granite Creek to Korenan Tee,718,720,1.8581070880516876e-06,0.0038763814608787895,3.34044813544156e-06,1
l_812,Wurdong to Calvale,930,432,2.1028548831862467e-05,0.04836618501009681,0.0006459539902039602,1
l_813,Nebo 275 to Broadsound,178,622,3.379101753420778e-05,0.07772018025621255,0.0010379909133910632,1
l_814,Nebo 275 to Broadsound,178,622,3.379221639382341e-05,0.07772293766312799,0.001038027739905275,1
l_815,Nebo 275 to Broadsound,178,622,3.4040120645987943e-05,0.07829312360514658,0.001045642851254831,1
l_816,Nebo 132 to Wandoo,841,840,2.683059886246762e-05,0.05597397301992955,4.823523063834156e-05,1
l_817,South Pine to Brendale,410,233,3.817148792687293e-07,0.0007769753813913012,3.391842649079793e-07,2
l_819,South Pine to Brendale,410,233,3.7686606142844453e-07,0.000767105679434779,3.3487570162121297e-07,1
l_820,Murarie to Doboy,230,100,4.54696779071463e-07,0.0009255290336422264,4.0403453242597893e-07,1
l_821,Murarie to Doboy,230,100,3.7559920573376985e-07,0.0007645270121100383,3.3374999879724676e-07,2
l_823,Newstead to Victoria Park,316,229,3.918903155493569e-06,0.00797687341847518,3.4822595561066964e-06,2
l_825,Newstead to Queensland Rail-Mayne,906,229,2.3402522946684282e-06,0.00476355132575737,2.079501736445279e-06,2
l_827,Newstead to McLachlan Street,229,393,2.7098127969091032e-06,0.005515786640046655,2.4078858631831856e-06,2
l_829,Point Henry to Geelong Terminal,863,861,1.0814033111406592e-05,0.024101868803167417,0.000140413683169669,2
l_831,Geelong Terminal to Moorabool Terminal,861,862,2.5773284967719082e-06,0.005744242934334923,3.346505260726155e-05,2
l_834,Moorabool Terminal to Ballarat Terminal,302,862,2.2168196858483906e-05,0.049407558381007285,0.00028784063614959067,1
l_835,Moorabool Terminal to Tarrone Terminal,618,862,1.2851974311342771e-05,0.032159362863686966,0.003965576343657962,1
l_836,Moorabool Terminal to Mortlake,619,862,9.840258042178485e-06,0.024623176282840584,0.00303628793228392,1
l_837,Heywood Terminal to Portland Aluminium,40,41,2.153034980248841e-06,0.0053875172413723384,0.0006643356404165453,1
l_838,Heywood Terminal to Portland Aluminium,40,41,2.153981937683089e-06,0.0053898868032004835,0.0006646278314767462,1
l_839,Heywood Terminal to South East,40,657,2.0199263930922793e-05,0.046458809124788246,0.0006204800549808973,2
l_841,Keilor Terminal to West Melbourne Terminal,144,142,4.213373059861836e-06,0.009390591249482617,5.4708102315594506e-05,2
l_843,Keilor Terminal to Altona Terminal,142,145,5.102710165185457e-06,0.011372708930599145,6.625560704870131e-05,1
l_844,Keilor Terminal to Brooklyn Terminal,142,146,5.224963292298276e-06,0.011645181633437657,6.784299000564955e-05,1
l_845,Brooklyn Terminal to Altona Terminal,145,146,2.520696633851753e-06,0.005618024185407586,3.2729722099627805e-05,1
l_846,Newport Power Station to Brooklyn Terminal,146,147,1.7314264874878024e-06,0.003858931595071846,2.248152634092155e-05,1
l_847,Newport Power Station to Fishermans Bend Terminal,147,139,1.5346193351962406e-06,0.00342029597086122,1.9926104432859935e-05,1
l_848,Brooklyn Terminal to Fishermans Bend Terminal,146,139,2.866606571908245e-06,0.006388973918856749,3.722115355236417e-05,1
l_849,Fishermans Bend Terminal to West Melbourne Terminal,139,144,9.944686865695935e-07,0.0022164305921420417,1.2912574766471843e-05,2
l_851,Laverton North to Altona Terminal,145,742,1.0746977526065136e-07,0.00023952418093726308,1.3954300692724466e-06,2
l_853,Thomastown Terminal to Brunswick Terminal,194,140,3.5389958702917423e-06,0.007887567319426145,4.59517221512628e-05,1
l_854,Thomastown Terminal to Brunswick Terminal,194,140,3.5134373114366315e-06,0.007830603462743094,4.561985971396645e-05,1
l_855,Cranbourne Terminal to Tyabb Terminal,494,493,7.640451418159643e-06,0.017028721456680065,9.920664322463619e-05,2
l_857,Tyabb Terminal to Western Port,494,496,6.395812015934147e-07,0.001425472074199299,8.304575293660516e-06,2
l_859,Cranbourne Terminal to East Rowville Terminal,493,196,6.860295263861362e-06,0.015289941754124202,8.907678714374818e-05,2
l_861,Rowville Terminal Station to East Rowville Terminal Station,196,191,6.789347478996438e-07,0.001513181627170025,8.815557304323786e-06,2
l_863,Heatherton Terminal to Springvale Terminal,197,200,2.8029209177292956e-06,0.006247033972321366,3.639423382905542e-05,2
l_865,Springvale Terminal to Rowville Terminal,191,200,2.618512870698451e-06,0.00583603296002581,3.3999806807890276e-05,1
l_866,Springvale Terminal to Rowville Terminal,191,200,2.6072034130948183e-06,0.005810826909647602,3.3852960337159364e-05,1
l_867,Rowville Terminal Station to Malvern Terminal Station,191,543,5.121335313354689e-06,0.0114142198889058,6.649744333929527e-05,1
l_868,Rowville Terminal Station to Malvern Terminal Station,191,543,5.12205584015258e-06,0.011415825769170176,6.650679894422748e-05,1
l_869,Rowville Terminal Station to Richmond Terminal Station,191,800,8.784155528191321e-06,0.019577761775462794,0.00011405694975610453,2
l_871,Richmond Terminal to Brunswick Terminal,140,800,2.867731078555899e-06,0.006391480172667038,3.7235754591451e-05,1
l_878,Bogong Power Station to Bogong Tee,736,737,8.219224441444573e-08,0.00018318666783304974,1.0672166107981187e-06,1
l_879,McKay Creek Power Station to Bogong Tee,737,740,2.091483384189975e-06,0.004661411483619423,2.715664750022944e-05,1
l_880,Eildon Power Station to Mount Beauty Terminal,198,735,4.784442339431467e-05,0.10663366791402175,0.0006212309171532562,1
l_881,Eildon Power Station to Mount Beauty Terminal,198,735,4.783842895602061e-05,0.10662030775839586,0.000621153082995479,1
l_882,Dederang Terminal to Glenrowan Terminal,683,682,2.8182529272444776e-05,0.0628120531968242,0.0003659331070483715,2
l_884,Glenrowan Terminal to Shepparton Terminal,683,213,2.448192610868462e-05,0.05456430223964849,0.000317883011878531,2
l_886,Bendigo Terminal to Fosterville Tee,679,75,8.297207654393055e-06,0.018492472536253083,0.00010773422596126681,1
l_887,Fosterville Terminal to Fosterville Tee,75,76,3.073168115034124e-08,6.849349725081019e-05,3.9903230329151717e-07,1
l_888,Waubra Terminal to Ballarat Terminal,303,302,1.3350952130001014e-05,0.029756048767340827,0.00017335404312920043,1
l_890,Loy Yang B Power Station to Loy Yang Power Station,275,774,8.875126949586272e-08,0.00022208138696723837,2.7384892488602706e-05,1
l_891,Yallourn Power Station to Yallourn,276,273,2.617479841688975e-07,0.0005833730587784135,3.3986393550639502e-06,1
l_892,Yallourn Power Station to Yallourn,273,276,3.461808389556794e-07,0.0007715535061455855,4.4949489371602645e-06,1
l_893,Yallourn Power Station to Hazelwood Power Station,274,273,5.050234344362394e-06,0.011255752996047594,6.557424023548658e-05,2
l_895,Morwell Terminal to Morwell Tee,277,776,2.2263851881443137e-07,0.0004962075033168623,2.89082658801918e-06,1
l_896,Morwell Power Station to Morwell Tee,278,277,5.206108822442459e-08,0.00011603159572460346,6.759817611157387e-07,1
l_897,Jeeralang A Power Station to Jeeralang Terminal,279,271,8.516396613155899e-08,0.00018980991803096512,1.1058026209717912e-06,1
l_898,Jeeralang B Power Station to Jeeralang Terminal,280,271,8.969969617283252e-08,0.00019991896516029654,1.164696333835196e-06,1
l_899,Jeeralang Terminal to Morwell Terminal,610,271,9.307280507218829e-07,0.002074368104742078,1.2084941139429108e-05,1
l_900,Jeeralang Terminal to Morwell Terminal,610,271,8.741095216705803e-07,0.0019481790737890072,1.1349783764022456e-05,1
l_902,South Morang Terminal to Rowville Terminal,191,195,2.6126255097090503e-06,0.00653754588658838,0.0008061458625073352,1
l_903,Hazelwood Power Station to Jeeralang Terminal,271,274,1.1771389231713514e-06,0.0026235584445780747,1.528443736967331e-05,2
l_905,Hazelwood Power Station to Jeeralang Terminal,271,274,1.3637909871536319e-06,0.003039560828850059,1.770800159450707e-05,1
l_906,Jeeralang Terminal to Hazelwood Power Station,271,274,1.3366307687679729e-06,0.0029790272597872793,1.7355342576365142e-05,1
l_907,Hazelwood Power Station to Hazelwood Terminal,272,274,1.2660380523343464e-06,0.0028216931391669324,1.6438738824806237e-05,1
l_908,Hazelwood Power Station to Hazelwood Terminal,272,274,1.2584733993945042e-06,0.0028048333542172025,1.634051637900448e-05,1
l_909,Loy Yang A Power Station to Loy Yang Power Station,275,35,3.477329285554948e-08,8.701285233039272e-05,1.0729569185129352e-05,1
l_910,Loy Yang A Power Station to Loy Yang Power Station,275,35,2.7397470623177132e-08,6.85564083753527e-05,8.453702034203941e-06,1
l_911,Loy Yang A Power Station to Loy Yang Power Station,275,35,2.273353165291107e-08,5.688588195775002e-05,7.014607495053777e-06,1
l_912,Loy Yang A Power Station to Loy Yang Power Station,275,35,2.6581802342471265e-08,6.65153700430189e-05,8.202021260504869e-06,1
l_920,Hazelwood Power Station to Rowville Terminal,274,191,3.9461735727446984e-05,0.08795068106874705,0.0005123867849002942,2
l_923,Yallourn Power Station to Rowville Terminal,273,191,3.6749254119473724e-05,0.08190521448168639,0.00047716685084037597,1
l_924,Yallourn Power Station to Rowville Terminal,273,191,3.6714779070551365e-05,0.08182837792149193,0.0004767192131693264,1
l_925,Yallourn Power Station to Rowville Terminal,273,191,3.6754335061864634e-05,0.08191653867550387,0.00047723282380603377,2
l_927,Rowville Terminal Station to Templestowe Terminal Station,191,192,7.903899395320981e-06,0.017615883389382574,0.00010262735596110855,1
l_928,Rowville Terminal Station to Ringwood Terminal Station,191,193,4.5645873887937816e-06,0.010173363189470618,5.926840807749202e-05,1
l_929,Thomastown Terminal to South Morang Terminal,194,195,2.9192549273132982e-06,0.006506314391333819,3.7904760622833715e-05,2
l_931,Jindabyne Power Station to Jindabyne Substation,207,211,3.742720268346464e-06,0.007808059909338197,6.72854811343871e-06,1
l_940,Mount Gambier to Blanche,651,652,1.6524069121415022e-05,0.034472499250673465,2.9706466457977797e-05,1
l_941,Snuggery Power Station to Snuggery Substation,655,654,1.0752891203443116e-07,0.00022432672680657695,1.9331219175753082e-07,1
l_942,Snuggery Power Station to Snuggery Substation,655,654,1.4071430534995467e-07,0.00029355806672636084,2.52971877648386e-07,2
l_945,Ladbroke Grove Power Station to Penola West,656,653,9.349669582278087e-08,0.00019505272902267152,1.6808550230473424e-07,1
l_946,Penola West to South East,657,653,3.555670246558272e-05,0.07417836309536424,6.392275300889551e-05,1
l_947,South East to Tailem Bend,657,879,6.867746231904788e-05,0.15795987041740278,0.002109631110390891,2
l_949,Robertstown to Tungkillo,472,759,2.378494962774933e-05,0.05470597535520331,0.000730624982336649,1
l_950,Tailem Bend to Tungkillo,879,759,1.3832346744513985e-05,0.0318147413365623,0.0004249013873922275,1
l_951,Mannum to Mannum-Adelaide Pumping Station 2,756,758,1.068230439686508e-05,0.022285414543513057,1.9204320372160652e-05,1
l_952,Mannum-Adelaide Pumping Station 2 to Pump 3 Tee,758,757,3.022395919093914e-06,0.006305319851341879,5.43357101290095e-06,1
l_953,Mannum-Adelaide Pumping Station 3 to Pump 3 Tee,757,760,1.4563644302682007e-07,0.00030382662625190487,2.6182074633351224e-07,1
l_954,Millbrook Tee to Para,795,123,1.786133964625815e-05,0.037262311906798136,3.211057053788696e-05,1
l_955,Magill to East Terrace,404,128,1.7656561560324408e-06,0.004061053046964715,5.4237344119020025e-05,1
l_956,Happy Valley to Cherry Gardens,13,12,2.016977597705993e-06,0.004639098609793536,6.195742453782962e-05,1
l_957,Kilburn to Northfield,121,636,2.1321063705125497e-06,0.004903897648950731,6.549394485486635e-05,1
l_958,Torrens A Power Station to Northfield,636,638,2.757276497574338e-06,0.006341804480754594,8.469789189661341e-05,1
l_959,Kilburn to Torrens A Power Station,121,638,2.2714126457416663e-06,0.005224305544648694,6.97731485728306e-05,1
l_960,Torrens A Power Station to Torrens A Power Station substation,796,638,4.8476456832273865e-08,0.00011149705567086768,1.4890975583779231e-06,1
l_961,Torrens A Power Station to Torrens A Power Station substation,796,638,4.4834555128050826e-08,0.00010312059122610565,1.3772257903076052e-06,2
l_963,Torrens A Power Station to Torrens A Power Station substation,796,638,4.852163699762191e-08,0.00011160097117419045,1.4904854006069801e-06,1
l_964,Torrens B Power Station to Torrens B Power Station substation,122,409,4.908630986096294e-08,0.00011289973279568435,1.5078309955004502e-06,1
l_965,Torrens B Power Station to Torrens B Power Station substation,122,409,4.6948054745508685e-08,0.00010798169288053121,1.4421481737829145e-06,1
l_966,Torrens B Power Station to Torrens B Power Station substation,122,409,4.929325753937136e-08,0.00011337571760002547,1.5141880047120802e-06,1
l_967,Torrens B Power Station to Torrens B Power Station substation,122,409,5.444023352503372e-08,0.00012521389030302615,1.6722925749325871e-06,1
l_968,Torrens Island A to Para,123,638,4.657505744315801e-06,0.0107123789813705,0.0001430690459904739,1
l_969,Pelican Point Power Station to Pelican Point Substation,797,129,3.7635596475704235e-08,8.656280738455684e-05,1.1560885114597836e-06,1
l_970,Pelican Point Power Station to Pelican Point Substation,797,129,3.597173990280033e-08,8.273589590917242e-05,1.1049782422258997e-06,2
l_972,Parafield Gardens West to Para,408,123,2.8508537842498478e-06,0.006557034566115158,8.75723946596817e-05,1
l_973,Pelican Point to Parafield Gardens West,129,408,2.941254590759988e-06,0.006764958668139091,9.034932245197907e-05,1
l_974,Torrens Island B to Cherry Gardens,13,409,1.4952387452833076e-05,0.034390862806024776,0.00045930674605555786,1
l_975,Torrens Island A to Magill,128,638,1.015302483690792e-05,0.023352209493882784,0.00031188014724550615,1
l_976,Para to Roseworthy,123,293,2.3345352272494847e-05,0.04870305448415909,4.196956083497405e-05,1
l_978,Monash to Berri,236,237,3.523743295468345e-06,0.007351230330740473,6.334878003971369e-06,1
l_979,Mintaro to Waterloo,868,871,1.6123182716750677e-05,0.033636170366858356,2.8985765131560155e-05,1
l_980,Waterloo to Templers,798,871,5.369732150693893e-05,0.11202330744381497,9.653540350795456e-05,1
l_981,Dorrien to Templers,798,294,1.7877176735965244e-05,0.037295351230166314,3.2139041973749324e-05,1
l_982,Dorrien to Templers,798,294,1.7849062768764793e-05,0.03723669989518764,3.2088499542735257e-05,1
l_983,Robertstown to Canowie,472,107,1.7561250614271154e-05,0.04039131292462502,0.0005394456839585682,1
l_984,Canowie to Davenport,107,584,2.9783109791648828e-05,0.06850189282563682,0.000914876188767148,1
l_985,Hallett Power Station to Canowie,9,107,4.9842822886280796e-08,0.00011463973155820622,1.5310695276147013e-06,1
l_986,Robertstown to Mokota,472,405,1.1913338938643908e-05,0.02740097568318071,0.0003659533943877794,1
l_987,Leigh Creek Coalfield to Leigh Creek South Tee,809,810,5.146484321390817e-06,0.010736591308663997,9.252192226173215e-06,1
l_988,Leigh Creek South to Leigh Creek South Tee,809,811,2.8992337046617055e-07,0.0006048378942082234,5.21215374787759e-07,1
l_989,Neuroodla Tee to Neuroodla,649,650,4.046467822766241e-06,0.008441737804606707,7.2746161836436355e-06,1
l_990,Cultana to Yadnarie,296,583,0.00013153733534074311,0.274413079529714,0.00023647380143232828,1
l_991,Yadnarie to Mount Millar Windfarm,296,297,3.158442889437975e-05,0.06589140927662844,5.678152098318805e-05,1
l_992,Yadnarie to Wudinna,296,592,0.00011604293859587859,0.2420886819341634,0.00020861844850407195,1
l_993,Port Lincoln Power Station to Port Lincoln Terminal,885,526,5.335513838368088e-08,0.00011130944529682002,9.59202371467598e-08,1
l_994,Port Lincoln Terminal to Sleaford,886,526,2.873556642840981e-05,0.05994811477078879,5.165992310878503e-05,1
l_995,Cathedral Rocks Wind Farm to Sleaford,390,886,8.182753582482277e-07,0.0017070853714536527,1.471070430932036e-06,1
l_996,Woomera to Pimba,101,102,1.2013571829746359e-05,0.02506270355418236,2.1597632276807252e-05,1
l_997,Pimba to Mount Gunson Tee,101,306,3.417931711292228e-05,0.07130486291882843,6.144653171752551e-05,1
l_998,Pimba to Olympic Dam North,101,367,8.992499085692261e-05,0.1876014410950747,0.0001616644002755402,1
l_999,Snowtown to Snowtown Tee,595,870,1.9900428507681236e-06,0.004151625739268125,3.5776382174331734e-06,1
l_1001,Bungama to Snowtown Tee,595,594,5.590565718270003e-05,0.11663033549293216,0.00010050548189469609,1
l_1002,Dalrymple to Ardrossan West,612,613,6.383406563185456e-05,0.13317057460197237,0.00011475893229661427,1
l_1005,Northern Power Station to Davenport,584,587,6.622892527464403e-07,0.0015232817435313266,2.0344170627340047e-05,1
l_1006,Northern Power Station to Davenport,584,587,6.730483044563705e-07,0.0015480278298968873,2.0674666680035307e-05,1
l_1007,Playford B to Davenport,584,588,7.614805969107572e-07,0.001751424300662152,2.339112574863454e-05,1
l_1008,Playford B to Davenport,584,588,7.308971216253322e-07,0.0016810815473065192,2.2451663969655728e-05,1
l_1009,Playford B Power Station to Playford B Substation,585,588,5.935957878850828e-08,0.00013652850668688436,1.8234047951594786e-06,1
l_1010,Playford B Power Station to Playford B Substation,585,588,5.183351525472122e-08,0.0001192183734873293,1.5922195236959466e-06,1
l_1011,Playford B Power Station to Playford B Substation,585,588,4.786342001669817e-08,0.00011008705575707389,1.4702663218371e-06,1
l_1012,Playford B Power Station to Playford B Substation,585,588,4.6681213327954486e-08,0.0001073679509874041,1.4339513514629814e-06,1
l_1013,Mount Gunson to Mount Gunson Tee,306,307,6.122648965831368e-08,0.00012773065177585288,1.1007111190410388e-07,1
l_1014,Olympic Dam West to Olympic Dam North,367,368,2.779757323415843e-06,0.005799127414948797,4.997362761110231e-06,1
l_1015,Olympic Dam West to Olympic Dam North,367,368,2.825419916994444e-06,0.005894388679674572,5.0794535763059275e-06,1
l_1016,Olympic Dam West to Prominent Hill,368,458,0.0001435077818426497,0.2993858150608435,0.0002579939043127412,1
l_1017,Davenport to Neuroodla Tee,649,584,8.335781555141879e-05,0.17390100543757514,0.00014985813321727803,1
l_1018,Tungkillo to Para,759,123,8.822663609232547e-06,0.020292345602061973,0.0002710141725983419,1
l_1019,Para to Robertstown,123,472,3.255682375147951e-05,0.07488150387815934,0.0010000790058689293,1
l_1020,Mount Barker South to Cherry Gardens,759,14,8.502521208887249e-06,0.019556010123637724,0.0002611800531548176,1
l_1021,Bungama to Red Hill,402,594,3.735300036411374e-05,0.07792579827649922,6.71520824724289e-05,1
l_1022,Brinkworth to Red Hill,495,402,1.7931026139880345e-05,0.037407691811803485,3.223585078636273e-05,1
l_1023,Clements Gap Wind Farm to Clements Gap Wind Farm Substation,398,353,1.067483251172793e-06,0.002226982670295763,1.9190887645416796e-06,1
l_1024,Clements Gap Wind Farm Substation to Red Hill,398,402,1.3581116490929703e-05,0.028332913921918498,2.4415716161392067e-05,1
l_1026,Para to Bungama,406,123,2.3666917389455563e-05,0.054434498273255444,0.0007269992735010951,1
l_1027,Bungama to Davenport,594,584,2.011461157784702e-05,0.04626410660854997,0.0006178797079152644,1
l_1030,Snuggery to South East,658,657,3.670947272666814e-05,0.07658327145476855,6.599516815331702e-05,1
l_1057,Mortlake Power Station to Mortlake Power Station substation,620,619,9.55369797000605e-08,0.00021292886075528417,1.2404899319608731e-06,1
l_1061,Eildon Power Station to Eildon Power Station substation,199,198,8.982476536875052e-08,0.000200197714200574,1.1663202817433444e-06,2
l_1074,Uranquinty Power Station to Uranquinty,445,448,2.2609267818466007e-07,0.00047167435708693174,4.0646250699729705e-07,1
l_1077,Gunning Wind Farm to Cullerin Range Tee,413,415,1.3406766665351756e-05,0.027969185460882135,2.4102275373446367e-05,1
l_1078,Kangaroo Valley Hydro Power Station to Kangaroo Valley,899,138,5.210087990915707e-08,0.00012292810496137728,3.235107563135047e-06,1
l_1079,Kangaroo Valley Hydro Power Station to Kangaroo Valley,899,138,4.0741818985377585e-08,9.612725561035456e-05,2.5297877303663084e-06,1
l_1080,Tallawarra Power Station to Tallawarra,894,514,9.795036296481426e-08,0.00020434396570828448,1.760921689797332e-07,1
l_1081,Jacks Gully Power Station to Nepean,900,512,9.377329770675316e-07,0.001956297756428416,1.6858276871823452e-06,1
l_1082,Warragamba Power Station to Warragamba Substation,180,853,1.0821310526002218e-07,0.0002257540901444569,1.9454221342818908e-07,1
l_1083,Mount Piper Power Station to Mount Piper,216,215,1.1463045645753046e-07,0.0002704619347648532,7.117765713323424e-06,1
l_1084,Mount Piper Power Station to Mount Piper,216,215,1.1891757126658975e-07,0.0002805770595026389,7.383966160743859e-06,1
l_1085,Eastern Creek II Power Station to Sydney West,848,712,3.150770578454883e-06,0.0065731349588743935,5.664359052114526e-06,1
l_1088,Colongra Power Station to Munmorah,162,916,9.201841972354985e-08,0.00021711053590418356,5.71371320627294e-06,1
l_1089,Colongra Power Station to Munmorah,162,916,9.370565571340135e-08,0.0002210914422385241,5.8184789975816366e-06,1
l_1090,Munmorah Power Station to Munmorah,935,916,4.087835480288463e-08,9.644940159588797e-05,2.5382656688699574e-06,1
l_1091,Vales Point Power Station to Vales Point,292,53,3.4473982269787434e-08,8.13387666059794e-05,2.140598027650032e-06,1
l_1092,Eraring Power Station to Eraring,909,905,4.0533472566233486e-08,0.00010142649065461842,1.2506917306324007e-05,1
l_1093,Eraring 500 to Eraring 330,57,905,6.092818088219098e-09,1.5245995908079402e-05,1.8799862722670343e-06,1
l_1094,Bayswater Power Station to Bayswater,244,246,1.1881206328257818e-07,0.00028032812135504043,7.377414838047543e-06,1
l_1095,Bayswater Power Station to Bayswater,244,246,9.553958882617375e-08,0.00022541846939376815,5.932353674818538e-06,1
l_1096,Bayswater Power Station to Bayswater,244,246,4.0160060324969156e-08,0.00010049210505178044,1.2391698063387673e-05,1
l_1097,Bayswater Power Station to Bayswater,244,246,4.9076009928661316e-08,0.00012280239385514517,1.5142783458760991e-05,1
l_1098,Liddell Power Station to Liddell,245,243,3.6693474766597906e-08,8.657549211012877e-05,2.278413300161218e-06,1
l_1102,Wallerawang Power Station to Wallerawang Power Station,716,93,3.760523311237419e-08,8.872671730679384e-05,2.3350272445958485e-06,1
l_1104,John Butters Power Station to Farrell,938,624,1.7546495179220047e-05,0.03910690122808064,0.0002278306335343432,1
l_1105,Electrona to Knights Road,136,137,2.1877008775067476e-05,0.04453035016416607,1.943947575209065e-05,1
l_1106,Lake Echo Power Station to Lake Echo Tee,428,429,1.7590018286785522e-06,0.0035804240047539503,1.563014109837983e-06,2
l_1108,Tungatinah to Lake Echo Tee,429,450,2.1912060975777778e-05,0.04460169843612149,1.9470622441876773e-05,1
l_1109,Tungatinah to Tarraleah,675,450,5.8542846659639e-07,0.0011916315837162542,5.202001150154513e-07,2
l_1110,Burnie to Emu Bay,623,323,4.317709689028966e-06,0.008788638626812428,3.836631125737004e-06,1
l_1112,Burnie to Sheffield,709,623,6.492480265646262e-05,0.13215354193789883,5.769089092234379e-05,1
l_1113,Burnie to Sheffield,709,944,1.6205988875834762e-05,0.036119236337362665,0.00021042496948362502,1
l_1114,New Norfolk to Boyer,21,492,2.673894286399057e-06,0.005442675006421016,2.3759693877047363e-06,2
l_1116,Devils Gate to Sheffield,709,268,6.41979812431808e-06,0.013067410695786904,5.704505184146842e-06,1
l_1117,Trevallyn to Mowbray,696,700,4.207827072995561e-06,0.008564974074714307,3.7389916142333995e-06,1
l_1118,Knights Road to Kermandie,137,295,2.8068016079604292e-05,0.05713206029622612,2.4940681955139692e-05,1
l_1119,Cethana Power Station to Cethana Substation,710,615,7.347339932035925e-08,0.00016375446724628095,9.540076775505264e-07,1
l_1121,Sheffield to Farrell,624,709,2.9360060058675298e-05,0.0654364850095475,0.00038122263252299786,2
l_1123,Palmerston to Hadspen,711,697,5.025366364655203e-05,0.10229064047199857,4.465440801140121e-05,2
l_1125,Catagunya Power Station to Catagunya,449,87,4.025105431646408e-08,8.970988162606038e-05,5.226356096575693e-07,1
l_1126,Meadowbank Power Station to Meadowbank,676,422,3.0813384773979415e-07,0.0006272022047603968,2.738016208304806e-07,1
l_1127,Risdon to Lindisfarne,22,867,4.1377469391756165e-06,0.008422326927170522,3.6767197983694007e-06,2
l_1129,Wayatinah Power Station to Wayatinah,552,451,5.35718961505707e-08,0.00011939882181385507,6.955986887954165e-07,1
l_1130,Wayatinah to Catagunya,552,449,2.1843972420006414e-06,0.0048684940390248364,2.8363077780060685e-05,1
l_1131,Triabunna to Sorell Tee,23,593,6.743826380815098e-05,0.1372696575074217,5.99243026110456e-05,1
l_1132,Lindisfarne to Sorell Tee,22,23,1.810564787278622e-05,0.0368537969707777,1.6088319313563644e-05,1
l_1133,Butlers Gorge to Butlers Gorge Tee,84,420,6.0453245737507436e-06,0.012305174939270387,5.371755420186911e-06,1
l_1134,Farrell to Reece,624,829,1.225366731573395e-05,0.0273104658510765,0.00015910646309406364,2
l_1136,Sheffield to Railton,709,781,1.6233554507611864e-05,0.03304317670050408,1.4424814309194306e-05,2
l_1138,George Town to Hadspen,697,713,1.7939534530338275e-05,0.0399828910440487,0.0002329340119272681,2
l_1139,George Town to Starwood,713,157,7.329045369992634e-06,0.01491817094605638,6.512444238643618e-06,1
l_1140,Hadspen to Trevallyn,697,696,1.2911677786870798e-05,0.02628154237024884,1.1473060592393907e-05,1
l_1141,Lake Echo Tee to Waddamana,190,429,2.4916829312971834e-05,0.05071786301754003,2.2140599943467523e-05,1
